{
  "version": "202610271600",
  "fetchedAt": "2026-10-27T09:01:30.465Z",
  "generatedAt": "2026-10-27T09:01:30.465Z",
  "source": "kkrb-radar+moligod",
  "items": [
    {
      "name": "战地医疗箱",
      "grade": 5,
      "pic": "https://playerhub.df.qq.com/playerhub/60004/object/14020000006.png",
      "current": 192681,
      "taxRate": 0.15,
      "curve": [
        [
          "202610201700",
          198351
        ],
        [
          "202610201800",
          198351
        ],
        [
          "202610201900",
          198351
        ],
        [
          "202610202000",
          198351
        ],
        [
          "202610202100",
          201186
        ],
        [
          "202610202200",
          206856
        ],
        [
          "202610202300",
          215361
        ],
        [
          "202610210000",
          170001
        ],
        [
          "202610210100",
          184176
        ],
        [
          "202610210200",
          181341
        ],
        [
          "202610210300",
          158661
        ],
        [
          "202610210400",
          189846
        ],
        [
          "202610210500",
          189846
        ],
        [
          "202610210600",
          192681
        ],
        [
          "202610210700",
          189846
        ],
        [
          "202610210800",
          187011
        ],
        [
          "202610210900",
          187011
        ],
        [
          "202610211000",
          187011
        ],
        [
          "202610211100",
          189846
        ],
        [
          "202610211200",
          189846
        ],
        [
          "202610211300",
          192681
        ],
        [
          "202610211400",
          192681
        ],
        [
          "202610211500",
          195516
        ],
        [
          "202610211600",
          198351
        ],
        [
          "202610211700",
          198351
        ],
        [
          "202610211800",
          198351
        ],
        [
          "202610211900",
          198351
        ],
        [
          "202610212000",
          198351
        ],
        [
          "202610212100",
          198351
        ],
        [
          "202610212200",
          198351
        ],
        [
          "202610212300",
          201186
        ],
        [
          "202610220000",
          184176
        ],
        [
          "202610220100",
          181341
        ],
        [
          "202610220200",
          158661
        ],
        [
          "202610220300",
          161496
        ],
        [
          "202610220400",
          189846
        ],
        [
          "202610220500",
          192681
        ],
        [
          "202610220600",
          192681
        ],
        [
          "202610220700",
          192681
        ],
        [
          "202610220800",
          189846
        ],
        [
          "202610220900",
          189846
        ],
        [
          "202610221000",
          189846
        ],
        [
          "202610221100",
          189846
        ],
        [
          "202610221200",
          189846
        ],
        [
          "202610221300",
          192681
        ],
        [
          "202610221400",
          192681
        ],
        [
          "202610221500",
          195516
        ],
        [
          "202610221600",
          195516
        ],
        [
          "202610221700",
          195516
        ],
        [
          "202610221800",
          195516
        ],
        [
          "202610221900",
          195516
        ],
        [
          "202610222000",
          195516
        ],
        [
          "202610222100",
          198351
        ],
        [
          "202610222200",
          198351
        ],
        [
          "202610222300",
          201186
        ],
        [
          "202610230000",
          175671
        ],
        [
          "202610230100",
          178506
        ],
        [
          "202610230200",
          161496
        ],
        [
          "202610230300",
          158661
        ],
        [
          "202610230400",
          181341
        ],
        [
          "202610230500",
          184176
        ],
        [
          "202610230600",
          184176
        ],
        [
          "202610230700",
          184176
        ],
        [
          "202610230800",
          181341
        ],
        [
          "202610230900",
          181341
        ],
        [
          "202610231000",
          181341
        ],
        [
          "202610231100",
          184176
        ],
        [
          "202610231200",
          184176
        ],
        [
          "202610231300",
          184176
        ],
        [
          "202610231400",
          187011
        ],
        [
          "202610231500",
          187011
        ],
        [
          "202610231600",
          189846
        ],
        [
          "202610231700",
          189846
        ],
        [
          "202610231800",
          189846
        ],
        [
          "202610231900",
          189846
        ],
        [
          "202610232000",
          189846
        ],
        [
          "202610232100",
          192681
        ],
        [
          "202610232200",
          192681
        ],
        [
          "202610232300",
          195516
        ],
        [
          "202610240000",
          164331
        ],
        [
          "202610240100",
          161496
        ],
        [
          "202610240200",
          155826
        ],
        [
          "202610240300",
          158661
        ],
        [
          "202610240400",
          164331
        ],
        [
          "202610240500",
          164331
        ],
        [
          "202610240600",
          170001
        ],
        [
          "202610240700",
          170001
        ],
        [
          "202610240800",
          172836
        ],
        [
          "202610240900",
          172836
        ],
        [
          "202610241000",
          175671
        ],
        [
          "202610241100",
          178506
        ],
        [
          "202610241200",
          181341
        ],
        [
          "202610241300",
          184176
        ],
        [
          "202610241400",
          187011
        ],
        [
          "202610241500",
          189846
        ],
        [
          "202610241600",
          189846
        ],
        [
          "202610241700",
          192681
        ],
        [
          "202610241800",
          192681
        ],
        [
          "202610241900",
          192681
        ],
        [
          "202610242000",
          192681
        ],
        [
          "202610242100",
          192681
        ],
        [
          "202610242200",
          192681
        ],
        [
          "202610242300",
          195516
        ],
        [
          "202610250000",
          158661
        ],
        [
          "202610250100",
          155826
        ],
        [
          "202610250200",
          158661
        ],
        [
          "202610250300",
          158661
        ],
        [
          "202610250400",
          161496
        ],
        [
          "202610250500",
          164331
        ],
        [
          "202610250600",
          167166
        ],
        [
          "202610250700",
          167166
        ],
        [
          "202610250800",
          170001
        ],
        [
          "202610250900",
          172836
        ],
        [
          "202610251000",
          175671
        ],
        [
          "202610251100",
          178506
        ],
        [
          "202610251200",
          181341
        ],
        [
          "202610251300",
          184176
        ],
        [
          "202610251400",
          187011
        ],
        [
          "202610251500",
          189846
        ],
        [
          "202610251600",
          192681
        ],
        [
          "202610251700",
          192681
        ],
        [
          "202610251800",
          189846
        ],
        [
          "202610251900",
          192681
        ],
        [
          "202610252000",
          192681
        ],
        [
          "202610252100",
          192681
        ],
        [
          "202610252200",
          192681
        ],
        [
          "202610252300",
          192681
        ],
        [
          "202610260000",
          178506
        ],
        [
          "202610260100",
          170001
        ],
        [
          "202610260200",
          152991
        ],
        [
          "202610260300",
          161496
        ],
        [
          "202610260400",
          181341
        ],
        [
          "202610260500",
          184176
        ],
        [
          "202610260600",
          184176
        ],
        [
          "202610260700",
          187011
        ],
        [
          "202610260800",
          187011
        ],
        [
          "202610260900",
          187011
        ],
        [
          "202610261000",
          187011
        ],
        [
          "202610261100",
          187011
        ],
        [
          "202610261200",
          187011
        ],
        [
          "202610261300",
          187011
        ],
        [
          "202610261400",
          187011
        ],
        [
          "202610261500",
          189846
        ],
        [
          "202610261600",
          189846
        ],
        [
          "202610261700",
          192681
        ],
        [
          "202610261800",
          192681
        ],
        [
          "202610261900",
          192681
        ],
        [
          "202610262000",
          192681
        ],
        [
          "202610262100",
          192681
        ],
        [
          "202610262200",
          192681
        ],
        [
          "202610262300",